{
  "schema_version": 1,
  "snapshot_id": "2026-10-14-14fdab3",
  "source_repository": "saga",
  "source_local_path": "/home/david/Projects/saga",
  "source_commit": "14fdab3bce1a5a565176cec9db5d7dc8d1c15ada",
  "base_head": "14fdab3bce1a5a565176cec9db5d7dc8d1c15ada",
  "captured_at": "2026-10-14T17:44:08.422582+00:00",
  "files": [
    {
      "source_path": "CLAUDE.md",
      "source_sha256": "6d7a8e8ca9ea4f6bfd6c2239075a6d72d7363cb57db7d67a864e32512b846360",
      "snapshot_path": "docs/history/saga-extraction/2026-10-14-14fdab3/CLAUDE.md",
      "source_status": "clean",
      "dirty": false,
      "untracked": false,
      "destination_path": "CLAUDE.md",
      "treatment": "adapted",
      "adapted_output_sha256": "3a9f32b315eb52c765c95c948197eed12c5edc32c7e95a8c0ab04a35c9a92392",
      "transformation": "Derived Odin-specific live entry point or authority from frozen joint source; see DECISION-MAP.md for clause ownership."
    },
    {
      "source_path": "README.md",
      "source_sha256": "422b60067aa2989584c7191beb69f35fddd2dff9e3dacda47f08a15fa0ce8052",
      "snapshot_path": "docs/history/saga-extraction/2026-10-14-14fdab3/README.md",
      "source_status": "clean",
      "dirty": false,
      "untracked": false,
      "destination_path": "README.md",
      "treatment": "adapted",
      "adapted_output_sha256": "8439c6f2eeda0496033d22d162b29572bc352e79d7f5f927513457d9430f3bd6",
      "transformation": "Derived Odin-specific live entry point or authority from frozen joint source; see DECISION-MAP.md for clause ownership. Follow-up 2026-10-14: operator-directed documentation corrections; reconcile sequencing provenance and producer pin status, record Apache-2.0 choice, typed journal triage and staged memory evaluation as applicable. Frozen source unchanged. 2026-10-16: revised under ODIN-ADR-006 to 015 (operator consolidation direction; Odin-owned clauses only; Saga-owned clauses untouched, see DECISIONS.md X-14). 2026-10-16 audit corrections: Clarify current documentation-only state, validator regressions, and the X-7 I0 review-schema dependency. Frozen source unchanged. 2026-10-16 partial I0 implementation: Record the partial I0 contract implementation and link its runnable Go/Python checks; Review/guidance and service work remain gated. Source metadata unchanged. 2026-10-16 local integration: reconcile the local service foundation from Odin 0b3d19e with the audit corrections and implement the ODIN-ADR-022 experimental coordination protocol. Preserve X-7 and all live/producer gates; synthetic tests are not full acceptance. Frozen source and source metadata unchanged. 2026-10-17 product implementation: record ADR-023 local continuity, attributed memory and mock-tested session/evaluation preparation; retain all live, producer and handoff gates. Frozen source and source metadata unchanged. 2026-10-21 web app: record ODIN-ADR-037 (web app as the primary human view with an agent tree, Chromium app presentation, Herdr as an optional inspection and attachment adapter) from the operator's verbatim handoff; amend only the named Odin-owned clauses (D20.11, D20.5's remaining overview text, ADR-010's surface list, ADR-007's human-view consequence, D15's parenthetical); add proposed AC-51 to AC-57; separate human-view delivery from the I4 import. Synthetic prototype only. Frozen source bytes and source metadata unchanged."
    },
    {
      "source_path": "docs/DECISIONS.md",
      "source_sha256": "685230a381b0075f261967781b396fa7cc9c5540012c102ae5d6a5f9d7842af9",
      "snapshot_path": "docs/history/saga-extraction/2026-10-14-14fdab3/docs/DECISIONS.md",
      "source_status": "clean",
      "dirty": false,
      "untracked": false,
      "destination_path": "docs/DECISIONS.md",
      "treatment": "split",
      "adapted_output_sha256": "879abce90f27d472022d64bc9a0b30707d4fd13268b73d99e07a71d18d51ab73",
      "transformation": "Derived Odin-specific live entry point or authority from frozen joint source; see DECISION-MAP.md for clause ownership. Follow-up 2026-10-14: operator-directed documentation corrections; reconcile sequencing provenance and producer pin status, record Apache-2.0 choice, typed journal triage and staged memory evaluation as applicable. Frozen source unchanged. Routing/Haiku follow-up: ADR-004–005, conservative journal attention, stable session classes, compactor effort/failure checks and request token accounting, with source-qualified claims as applicable. 2026-10-15: inspect pinned OptChat cache correction, state exact merge priority and completion of source review; retain runtime checks and compactor-context issue X-10 as open. 2026-10-16: revised under ODIN-ADR-006 to 015 (operator consolidation direction; Odin-owned clauses only; Saga-owned clauses untouched, see DECISIONS.md X-14). 2026-10-16 audit corrections: Clarify X-7 sequencing, FLAG escalation, source-side migration refusal, workload-class configuration, and the B-12 producer event gap; preserve open decisions. Frozen source unchanged. 2026-10-16 local integration: reconcile the local service foundation from Odin 0b3d19e with the audit corrections and implement the ODIN-ADR-022 experimental coordination protocol. Preserve X-7 and all live/producer gates; synthetic tests are not full acceptance. Frozen source and source metadata unchanged. 2026-10-17 product implementation: record ADR-023 local continuity, attributed memory and mock-tested session/evaluation preparation; retain all live, producer and handoff gates. Frozen source and source metadata unchanged. 2026-10-19 executive pilot: record ODIN-ADR-024 for bounded native Fable conversation through Remote Control; amend only Odin-owned D7.2 invocation and D7.7 interactive transport, preserving service authority, dedicated credentials, Saga/worker gates and unverified evidence boundaries. Frozen source and source metadata unchanged. 2026-10-19 repository evidence: record ODIN-ADR-025 for opt-in native read tools and operator-selected committed repository snapshots; preserve service authority, credential separation, producer gates and frozen source metadata. 2026-10-19 native development: apply ODIN-ADR-026 operator-authorized version 3 tool/environment/direct-development exception to Odin-owned pilot and planner rules; preserve Saga producer authority and frozen source identities/bytes. 2026-10-20 delegation sessions: record ODIN-ADR-027 for the version 3 executive's local-backend delegation path (one accountable session per project, owned commitments and local assignments, detached Claude Code/Codex turns, explicit executive acceptance); amend only ADR-024's bridge rule; preserve Saga producer authority, X-12/X-15 gates and frozen source identities/bytes. 2026-10-20 lineage enforcement: amend ODIN-ADR-027 so the delegation runner enforces credential refresh ownership with the executive lineage lease, refuses shared lineages unless the operator accepts them, and records content-free credential fingerprints per turn; frozen source identities/bytes unchanged. 2026-10-20 development evaluator: record ODIN-ADR-028 for an operator-configured independent development evaluator and durable feedback controller in the existing native executive session; amend only Odin-owned D7.7 transport and D9.3/D9.4 development planning and activation rules, preserving Mimir review, Saga authority, operator control and frozen source metadata. 2026-10-20 execution receipts: record ODIN-ADR-029 (structured execution receipts as attributed local evidence, validated in the ADR-028 loop); frozen source identities/bytes unchanged. 2026-10-20 receipt corrections: amend ODIN-ADR-029 with consistency checks, the uncertain observation outcome and bounded file inspection; frozen source identities/bytes unchanged. 2026-10-20 receipt corrections (second review): amend ODIN-ADR-029 status list and recomputed derived fields; frozen source identities/bytes unchanged. 2026-10-20 intervention recovery: clarify ADR-028 operator-response continuation with unchanged bounds and retained history, and ADR-029 clock-reversal evidence preservation; frozen source identities/bytes unchanged. 2026-10-21 loop notices: record ODIN-ADR-030 (durable notices, model-attributed acknowledgement and conservative deadline attention for the ADR-028 loop); frozen source identities/bytes unchanged. 2026-10-20: ODIN-ADR-031 local usage, context and delegated-stage experiment; preserves producer and review boundaries. Frozen source metadata unchanged. 2026-10-21: integrate preserved stage-five notice/recovery corrections with ADR-031. Frozen source metadata unchanged. 2026-10-21: ODIN-ADR-032 records opt-in native peer coordination; durable task and producer authority unchanged. Frozen source metadata unchanged. 2026-10-21: ODIN-ADR-033 records executive role and explicit paused-loop delegation transition; frozen source identities and bytes unchanged. 2026-10-21: ADR-034 records bounded executive interventions and concise working context; frozen source identities and bytes unchanged. 2026-10-21: amend ODIN-ADR-027 so the delegation budget limit is optional and an unrequested budget passes no harness option; frozen source identities and bytes unchanged. 2026-10-21: amend ODIN-ADR-027 for durable delegation failure notices and ODIN-ADR-034 for the configured executive memory directory; frozen source identities and bytes unchanged. 2026-10-21: add proposed ODIN-ADR-036 for workstream sessions and cross-reference it from ODIN-ADR-022 and ODIN-ADR-027; record the session-level budget as informational and fix an amendment line wrap; frozen source identities and bytes unchanged. 2026-10-21: ODIN-ADR-036 accepted as phase 1 with implementation notes and ADR-022/ADR-027 cross-references updated; frozen source identities and bytes unchanged. 2026-10-21 web app: record ODIN-ADR-037 (web app as the primary human view with an agent tree, Chromium app presentation, Herdr as an optional inspection and attachment adapter) from the operator's verbatim hando